{
  "schema_version": "1.0",
  "request_id": "11111111-1111-4111-8111-111111111111",
  "project_id": "example-lab",
  "workspace_id": null,
  "status": "COMPLETED",
  "run_ids": [],
  "publication": {
    "status": "NOT_REQUESTED",
    "repository": null,
    "branch": null,
    "commit": null,
    "pull_request_url": null,
    "reason": "FORMAT EXAMPLE ONLY; no cloud action occurred"
  },
  "delivery": {
    "status": "NOT_ATTEMPTED",
    "reason": "FORMAT EXAMPLE ONLY"
  },
  "outputs": [],
  "effects": [],
  "created_at": "2026-09-26T05:00:00Z"
}
